{
    "time": {
        "when": "2023-12-01T01:01:01+01:00"
    },
    "subject": {
        "kind": "user",
        "id": "user_id",
        "agent": {
            "client": "jsClient",
            "version": "v1.0.0"
        }
    },
    "action": {
        "kind": "dispositive",
        "operation": "logout",
        "status": {
            "result": "succeeded",
            "code": 0
        }
    },
    "target": {
        "kind": "urn:ietf:params:oauth:grant-type:jwt-bearer",
        "id": "jws_id_identify_user_session"
    }
}